[
  {
    "caseId": "nasal_001",
    "title": "Small Central Tip",
    "module": "nose",
    "status": "reviewed",
    "difficulty": "easy",
    "vignette": {
      "text": "An older man presents after Mohs surgery with a 0.8 × 0.8 cm defect. The defect extends to subcutaneous fat. Cartilage is intact and not exposed. Patient context: Best cosmetic outcome; accepts staged.",
      "defectSize": "0.8 × 0.8 cm",
      "laterality": "midline",
      "depth": "subcutaneous_fat",
      "cartilageStatus": "intact_not_exposed",
      "patientContext": "Best cosmetic outcome; accepts staged"
    },
    "images": [
      {
        "src": "/cases/nasal_001.webp",
        "view": "composite",
        "label": "Clinical image",
        "alt": "Clinical image for nasal_001"
      }
    ],
    "answers": {
      "subunits": [
        "tip"
      ],
      "structuralRequirement": "none",
      "preferredReconstruction": "bilobed_flap"
    },
    "feedback": {
      "preferredLabel": "Bilobed flap",
      "preferredRationale": "A bilobed flap is preferred because this is a small (0.8 × 0.8 cm), central nasal tip defect without cartilage exposure or loss. Bilobed flaps are workhorse flaps for small nasal tip defects, generally those measuring approximately ≤1.5 cm in diameter. They recruit adjacent nasal skin with an excellent color, texture, and contour match while minimizing distortion of the nasal tip.",
      "acceptableAlternatives": [
        {
          "id": "primary_closure",
          "label": "Primary closure",
          "rationale": ""
        },
        {
          "id": "full_thickness_skin_graft",
          "label": "Full-thickness skin graft",
          "rationale": ""
        }
      ],
      "teachingPearl": "Bilobed flaps are the workhorse reconstruction for small central nasal tip defects but become progressively less favorable as defect size approaches 1.5–2.0 cm because of increasing tension and risk of tip distortion."
    }
  },
  {
    "caseId": "nasal_002",
    "title": "Medium Central Tip",
    "module": "nose",
    "status": "reviewed",
    "difficulty": "easy",
    "vignette": {
      "text": "An older man presents after Mohs surgery with a 1.2 × 1.2 cm defect. The defect extends to perichondrium. The lower lateral cartilage is intact. Patient context: Best cosmetic outcome.",
      "defectSize": "1.2 × 1.2 cm",
      "laterality": "midline",
      "depth": "perichondrium",
      "cartilageStatus": "intact",
      "patientContext": "Best cosmetic outcome"
    },
    "images": [
      {
        "src": "/cases/nasal_002.webp",
        "view": "composite",
        "label": "Clinical image",
        "alt": "Clinical image for nasal_002"
      }
    ],
    "answers": {
      "subunits": [
        "tip"
      ],
      "structuralRequirement": "none",
      "preferredReconstruction": "bilobed_flap"
    },
    "feedback": {
      "preferredLabel": "Bilobed flap",
      "preferredRationale": "A bilobed flap is the preferred reconstruction for this 1.2 × 1.2 cm nasal tip defect because it provides an excellent color and texture match while preserving the contour of the nasal tip. Defects between approximately 1.0 and 1.5 cm are often too large for primary closure yet remain well suited to local tissue rearrangement. The bilobed flap recruits adjacent dorsal nasal skin with similar characteristics, allowing closure with minimal tension and avoiding the patch-like appearance that may occur with a skin graft.",
      "acceptableAlternatives": [
        {
          "id": "rieger_flap",
          "label": "Rieger (dorsal nasal) flap",
          "rationale": ""
        },
        {
          "id": "full_thickness_skin_graft",
          "label": "Full-thickness skin graft",
          "rationale": ""
        }
      ],
      "teachingPearl": "For isolated nasal tip defects measuring approximately 1.0–1.5 cm, a bilobed flap is commonly the workhorse reconstruction because it provides excellent tissue match while minimizing distortion of the surrounding nasal anatomy. Final flap selection should still consider defect geometry, skin quality, patient factors, and surgeon experience."
    }
  },
  {
    "caseId": "nasal_003",
    "title": "Large Central Tip",
    "module": "nose",
    "status": "reviewed",
    "difficulty": "easy",
    "vignette": {
      "text": "An older man presents after Mohs surgery with a 1.8 × 1.8 cm defect. The defect extends to perichondrium. The lower lateral cartilage is intact. Patient context: Best cosmetic outcome; accepts staged.",
      "defectSize": "1.8 × 1.8 cm",
      "laterality": "midline",
      "depth": "perichondrium",
      "cartilageStatus": "intact",
      "patientContext": "Best cosmetic outcome; accepts staged"
    },
    "images": [
      {
        "src": "/cases/nasal_003.webp",
        "view": "composite",
        "label": "Clinical image",
        "alt": "Clinical image for nasal_003"
      }
    ],
    "answers": {
      "subunits": [
        "tip"
      ],
      "structuralRequirement": "none",
      "preferredReconstruction": "paramedian_forehead_flap"
    },
    "feedback": {
      "preferredLabel": "Paramedian forehead flap",
      "preferredRationale": "A paramedian forehead flap is the preferred reconstruction for this 1.8 × 1.8 cm nasal tip defect because it provides the best opportunity to restore the contour, color, and texture of the nasal tip. At this size, local flaps may create excessive tension, flatten the nasal tip, or distort the surrounding nasal subunits. The forehead flap recruits abundant, well-vascularized tissue with excellent skin characteristics and allows precise sculpting of the reconstructed tip. Because the patient prioritizes the best cosmetic outcome and is willing to undergo a staged procedure, the additional complexity is justified.",
      "acceptableAlternatives": [
        {
          "id": "rieger_flap",
          "label": "Rieger (dorsal nasal) flap",
          "rationale": ""
        },
        {
          "id": "full_thickness_skin_graft",
          "label": "Full-thickness skin graft",
          "rationale": ""
        }
      ],
      "teachingPearl": "As nasal tip defects approach 2 cm, surgeons should increasingly consider a paramedian forehead flap, particularly when the patient is willing to undergo staged reconstruction and places the highest priority on long-term cosmetic outcome. While experienced surgeons may occasionally achieve excellent results with large local flaps, the forehead flap often offers the greatest flexibility for restoring nasal contour with the least distortion."
    }
  },
  {
    "caseId": "nasal_005",
    "title": "Tip Near Ala",
    "module": "nose",
    "status": "reviewed",
    "difficulty": "moderate",
    "vignette": {
      "text": "An older man presents after Mohs surgery with a 1.8 cm maximum dimension defect. Patient context: Best cosmetic outcome; accepts staged.",
      "defectSize": "1.8 cm maximum dimension",
      "laterality": "left",
      "depth": "perichondrium",
      "cartilageStatus": "intact",
      "patientContext": "Best cosmetic outcome; accepts staged"
    },
    "images": [
      {
        "src": "/cases/nasal_005.webp",
        "view": "composite",
        "label": "Clinical image",
        "alt": "Clinical image for nasal_005"
      }
    ],
    "answers": {
      "subunits": [
        "tip",
        "ala",
        "soft_triangle"
      ],
      "structuralRequirement": "none",
      "preferredReconstruction": "paramedian_forehead_flap"
    },
    "feedback": {
      "preferredLabel": "Paramedian forehead flap",
      "preferredRationale": "A paramedian forehead flap is the preferred reconstruction for this 1.8 × 1.8 cm defect involving the nasal tip, ala, and soft triangle. Although the defect is less than 2 cm, it involves multiple aesthetic subunits, including the soft triangle, where even subtle distortion can produce noticeable cosmetic deformity. A forehead flap provides abundant, well-vascularized tissue with an excellent color and texture match, allowing precise restoration of the complex three-dimensional contour of the nasal tip and adjacent ala while minimizing tension on the surrounding nasal structures. Because the patient prioritizes the best cosmetic outcome and accepts a staged reconstruction, a paramedian forehead flap offers the most predictable long-term aesthetic result.",
      "acceptableAlternatives": [],
      "teachingPearl": "Reconstructive planning depends on more than defect size alone. Once a defect crosses multiple nasal subunits—particularly the ala and soft triangle—preserving contour and minimizing distortion often become more important than simply achieving wound closure. Cartilage grafting should also be considered whenever defects approach the alar rim or involve the ala, even if the lower lateral cartilage is intact, as grafts may help prevent postoperative alar retraction or external nasal valve collapse. In this case, however, the existing structural support is adequate, and additional cartilage grafting is not required."
    }
  },
  {
    "caseId": "nasal_006",
    "title": "Ala + sidewall",
    "module": "nose",
    "status": "reviewed",
    "difficulty": "moderate",
    "vignette": {
      "text": "An older man presents after Mohs surgery with a 1.6 cm maximum dimension defect. The defect is superficial, with intact underlying cartilage and no internal nasal lining loss. Patient context: Best cosmetic outcome.",
      "defectSize": "1.6 cm maximum dimension",
      "laterality": "left",
      "depth": "superficial",
      "cartilageStatus": "intact",
      "patientContext": "Best cosmetic outcome"
    },
    "images": [
      {
        "src": "/cases/nasal_006.webp",
        "view": "composite",
        "label": "Clinical image",
        "alt": "Clinical image for nasal_006"
      }
    ],
    "answers": {
      "subunits": [
        "ala",
        "sidewall"
      ],
      "structuralRequirement": "none",